{
  "dataset_id": "fictional-beacon",
  "profile_version": "0.1-draft",
  "window": {
    "start": "2026-10-01T00:00:00Z",
    "end": "2026-10-11T00:00:00Z",
    "timezone": "UTC",
    "calendar_days": 10
  },
  "evidence_cutoff": "2026-10-12T00:00:00Z",
  "collection_complete": true,
  "deployment_history_complete": true,
  "services": [
    {
      "id": "service:beacon",
      "name": "Beacon",
      "source_refs": [
        "https://example.invalid/services/beacon"
      ],
      "observed_at": "2026-10-12T00:00:00Z"
    }
  ],
  "deployments": [
    {
      "id": "deployment:d1",
      "service_id": "service:beacon",
      "rollout_group_id": "rollout:r1",
      "environment": "production",
      "qualification": "qualifying",
      "effective_at": "2026-10-01T00:00:00Z",
      "change_ids": [],
      "failure": "no_recorded_failure",
      "rework": "not_incident_driven",
      "source_refs": [
        "https://example.invalid/deployments/d1"
      ],
      "observed_at": "2026-10-12T00:00:00Z",
      "change_links_complete": true,
      "qualification_window": null,
      "failure_evidence_refs": [
        "https://example.invalid/deployments/d1/failure-review"
      ],
      "rework_evidence_refs": [
        "https://example.invalid/deployments/d1/intent-review"
      ]
    },
    {
      "id": "deployment:at-end",
      "service_id": "service:beacon",
      "rollout_group_id": "rollout:at-end",
      "environment": "production",
      "qualification": "qualifying",
      "effective_at": "2026-10-11T00:00:00Z",
      "change_ids": [],
      "failure": "no_recorded_failure",
      "rework": "not_incident_driven",
      "source_refs": [
        "https://example.invalid/deployments/d1"
      ],
      "observed_at": "2026-10-12T00:00:00Z",
      "change_links_complete": true,
      "qualification_window": null,
      "failure_evidence_refs": [
        "https://example.invalid/deployments/d1/failure-review"
      ],
      "rework_evidence_refs": [
        "https://example.invalid/deployments/d1/intent-review"
      ]
    }
  ],
  "changes": [],
  "incidents": [],
  "snapshot_as_of_cutoff": true,
  "recovery_evidence_complete": true
}
